{
  "schema_version": "1.0",
  "fixture_id": "synthetic.matcher.repeated-edge-gaps",
  "network_snapshot_id": "test.snapshot.matcher-v1",
  "evidence_classification": "SYNTHETIC",
  "configuration": {
    "ambiguity_margin_meters": 3,
    "stale_observation_threshold_ms": 10000,
    "observation_gap_threshold_ms": 10000
  },
  "edges": [
    {
      "directed_edge_id": "test.edge.shared-loop-geometry",
      "coordinates": [
        { "latitude": 35.01, "longitude": 139.0 },
        { "latitude": 35.01, "longitude": 139.001 }
      ]
    }
  ],
  "route_occurrences": [
    { "occurrence_id": "test.occurrence.lap-1", "index": 0, "directed_edge_id": "test.edge.shared-loop-geometry" },
    { "occurrence_id": "test.occurrence.lap-2", "index": 1, "directed_edge_id": "test.edge.shared-loop-geometry" },
    { "occurrence_id": "test.occurrence.lap-3", "index": 2, "directed_edge_id": "test.edge.shared-loop-geometry" },
    { "occurrence_id": "test.occurrence.lap-4", "index": 3, "directed_edge_id": "test.edge.shared-loop-geometry" }
  ],
  "initial_occurrence_id": "test.occurrence.lap-1",
  "observations": [
    { "observation_id": "lap-1-a", "observed_at_ms": 0, "received_at_ms": 0, "coordinate": { "latitude": 35.01, "longitude": 139.0002 }, "horizontal_accuracy_meters": 6, "course_degrees": 90, "speed_meters_per_second": 16, "source": "PHONE" },
    { "observation_id": "lap-1-b", "observed_at_ms": 1000, "received_at_ms": 1000, "coordinate": { "latitude": 35.01, "longitude": 139.0007 }, "horizontal_accuracy_meters": 6, "course_degrees": 90, "speed_meters_per_second": 16, "source": "PHONE" },
    { "observation_id": "lap-2-a", "observed_at_ms": 16000, "received_at_ms": 16000, "coordinate": { "latitude": 35.01, "longitude": 139.0002 }, "horizontal_accuracy_meters": 8, "course_degrees": 90, "speed_meters_per_second": 15, "source": "WIRED_CARPLAY" },
    { "observation_id": "lap-2-b", "observed_at_ms": 17000, "received_at_ms": 17000, "coordinate": { "latitude": 35.01, "longitude": 139.0007 }, "horizontal_accuracy_meters": 8, "course_degrees": 90, "speed_meters_per_second": 15, "source": "WIRED_CARPLAY" },
    { "observation_id": "lap-3-a", "observed_at_ms": 47000, "received_at_ms": 47000, "coordinate": { "latitude": 35.01, "longitude": 139.0002 }, "horizontal_accuracy_meters": 10, "course_degrees": 90, "speed_meters_per_second": 14, "source": "WIRELESS_CARPLAY" },
    { "observation_id": "lap-3-b", "observed_at_ms": 48000, "received_at_ms": 48000, "coordinate": { "latitude": 35.01, "longitude": 139.0007 }, "horizontal_accuracy_meters": 10, "course_degrees": 90, "speed_meters_per_second": 14, "source": "WIRELESS_CARPLAY" },
    { "observation_id": "lap-4-a", "observed_at_ms": 108000, "received_at_ms": 108000, "coordinate": { "latitude": 35.01, "longitude": 139.0005 }, "horizontal_accuracy_meters": 5, "course_degrees": 90, "speed_meters_per_second": 15, "source": "ACCESSORY" }
  ],
  "ground_truth_intervals": [
    { "start_ms": 0, "end_ms": 1000, "directed_edge_id": "test.edge.shared-loop-geometry", "occurrence_id": "test.occurrence.lap-1", "classification": "ON_ROUTE" },
    { "start_ms": 16000, "end_ms": 17000, "directed_edge_id": "test.edge.shared-loop-geometry", "occurrence_id": "test.occurrence.lap-2", "classification": "ON_ROUTE" },
    { "start_ms": 47000, "end_ms": 48000, "directed_edge_id": "test.edge.shared-loop-geometry", "occurrence_id": "test.occurrence.lap-3", "classification": "ON_ROUTE" },
    { "start_ms": 108000, "end_ms": 108000, "directed_edge_id": "test.edge.shared-loop-geometry", "occurrence_id": "test.occurrence.lap-4", "classification": "ON_ROUTE" }
  ],
  "branch_decisions": [],
  "expected_negative_control_failures": ["ROUTE_OCCURRENCE_UNAVAILABLE"]
}
